{
  "$schema": "https://json-schema.org/draft/2020-12/schema",
  "$id": "reference_factory.knowledge_pack.v1",
  "title": "Reference Factory Creative Knowledge Pack",
  "type": "object",
  "additionalProperties": false,
  "required": [
    "schema",
    "packId",
    "sourceFingerprint",
    "generatedAt",
    "policy",
    "summary",
    "goldReferences",
    "promptCards",
    "patternCards",
    "captionPatterns",
    "audioPatterns",
    "provenance"
  ],
  "properties": {
    "schema": { "const": "reference_factory.knowledge_pack.v1" },
    "packId": { "type": "string", "pattern": "^kp_[a-f0-9]{16}$" },
    "sourceFingerprint": { "type": "string", "pattern": "^[a-f0-9]{64}$" },
    "generatedAt": { "type": "string", "format": "date-time" },
    "policy": {
      "type": "object",
      "additionalProperties": false,
      "required": [
        "humanGoldLabelsAuthoritative",
        "measuredFactsSource",
        "minimumMeasuredExamplesForRecommendation"
      ],
      "properties": {
        "humanGoldLabelsAuthoritative": { "const": true },
        "currentSignedReferenceRightsRequired": { "type": "boolean" },
        "measuredFactsSource": {
          "const": "campaign_factory.performance_snapshots"
        },
        "minimumMeasuredExamplesForRecommendation": {
          "type": "integer",
          "minimum": 3
        }
      }
    },
    "summary": {
      "type": "object",
      "additionalProperties": false,
      "required": [
        "goldReferenceCount",
        "promptCardCount",
        "patternCardCount",
        "captionPatternCount",
        "audioPatternCount",
        "measuredExampleCount",
        "eligiblePatternCount",
        "advisoryPatternCount"
      ],
      "properties": {
        "goldReferenceCount": { "$ref": "#/$defs/nonNegativeInteger" },
        "promptCardCount": { "$ref": "#/$defs/nonNegativeInteger" },
        "patternCardCount": { "$ref": "#/$defs/nonNegativeInteger" },
        "captionPatternCount": { "$ref": "#/$defs/nonNegativeInteger" },
        "audioPatternCount": { "$ref": "#/$defs/nonNegativeInteger" },
        "measuredExampleCount": { "$ref": "#/$defs/nonNegativeInteger" },
        "eligiblePatternCount": { "$ref": "#/$defs/nonNegativeInteger" },
        "advisoryPatternCount": { "$ref": "#/$defs/nonNegativeInteger" }
      }
    },
    "goldReferences": {
      "type": "array",
      "items": { "$ref": "#/$defs/goldReference" }
    },
    "promptCards": {
      "type": "array",
      "items": { "$ref": "#/$defs/promptCard" }
    },
    "patternCards": {
      "type": "array",
      "items": { "$ref": "#/$defs/patternCard" }
    },
    "captionPatterns": {
      "type": "array",
      "items": { "$ref": "#/$defs/captionPattern" }
    },
    "audioPatterns": {
      "type": "array",
      "items": { "$ref": "#/$defs/audioPattern" }
    },
    "invalidatedPatternIds": {
      "type": "array",
      "uniqueItems": true,
      "items": { "type": "string", "minLength": 1 }
    },
    "provenance": {
      "type": "object",
      "additionalProperties": false,
      "required": ["producer", "sourceTables", "measuredFactsSource"],
      "properties": {
        "producer": { "const": "reference_factory" },
        "sourceTables": {
          "type": "array",
          "items": { "type": "string" },
          "uniqueItems": true
        },
        "measuredFactsSource": {
          "const": "campaign_factory.performance_snapshots"
        }
      }
    }
  },
  "$defs": {
    "nonNegativeInteger": { "type": "integer", "minimum": 0 },
    "nullableString": { "type": ["string", "null"] },
    "recommendationStatus": {
      "type": "string",
      "enum": ["advisory", "eligible"]
    },
    "outcomeProvenance": {
      "type": "object",
      "additionalProperties": false,
      "required": [
        "promptId",
        "postId",
        "rewardScore",
        "sourceSnapshotAt",
        "scoringVersion",
        "baselineProvenance",
        "outcome"
      ],
      "properties": {
        "promptId": { "type": "string", "minLength": 1 },
        "postId": { "type": "string", "minLength": 1 },
        "rewardScore": { "type": "number" },
        "confidence": { "type": ["number", "null"] },
        "sourceSnapshotAt": { "type": "string", "format": "date-time" },
        "scoringVersion": { "type": "string", "minLength": 1 },
        "baselineProvenance": { "type": "object" },
        "outcome": { "type": "object" }
      }
    },
    "goldReference": {
      "type": "object",
      "additionalProperties": false,
      "required": [
        "referenceId",
        "label",
        "account",
        "localPath",
        "contentHash",
        "tags",
        "notes",
        "promptCardIds",
        "patternCardIds",
        "captionPatternIds",
        "measuredExampleCount",
        "measuredOutcomeProvenance"
      ],
      "properties": {
        "referenceId": { "type": "string", "minLength": 1 },
        "label": { "const": "gold" },
        "account": { "$ref": "#/$defs/nullableString" },
        "localPath": { "$ref": "#/$defs/nullableString" },
        "contentHash": { "$ref": "#/$defs/nullableString" },
        "tags": { "type": "array", "items": { "type": "string" } },
        "notes": { "$ref": "#/$defs/nullableString" },
        "lifecycle": { "$ref": "#/$defs/referenceLifecycle" },
        "promptCardIds": { "type": "array", "items": { "type": "string" } },
        "patternCardIds": { "type": "array", "items": { "type": "string" } },
        "captionPatternIds": { "type": "array", "items": { "type": "string" } },
        "measuredExampleCount": { "$ref": "#/$defs/nonNegativeInteger" },
        "measuredOutcomeProvenance": {
          "type": "array",
          "items": { "$ref": "#/$defs/outcomeProvenance" }
        }
      }
    },
    "promptCard": {
      "type": "object",
      "additionalProperties": false,
      "required": [
        "id",
        "referenceId",
        "targetTool",
        "modelProfile",
        "status",
        "prompt",
        "measuredExampleCount",
        "recommendationStatus",
        "measuredOutcomeProvenance"
      ],
      "properties": {
        "id": { "type": "string", "minLength": 1 },
        "referenceId": { "type": "string", "minLength": 1 },
        "targetTool": { "type": "string", "minLength": 1 },
        "modelProfile": { "$ref": "#/$defs/nullableString" },
        "status": { "type": "string", "minLength": 1 },
        "prompt": { "type": "object" },
        "measuredExampleCount": { "$ref": "#/$defs/nonNegativeInteger" },
        "recommendationStatus": { "$ref": "#/$defs/recommendationStatus" },
        "measuredOutcomeProvenance": {
          "type": "array",
          "items": { "$ref": "#/$defs/outcomeProvenance" }
        }
      }
    },
    "patternCard": {
      "type": "object",
      "additionalProperties": false,
      "required": [
        "id",
        "clusterKey",
        "rank",
        "label",
        "visualFormat",
        "hookType",
        "captionArchetype",
        "qualityScore",
        "referenceIds",
        "promptCardIds",
        "captionPatternIds",
        "audioPatternIds",
        "pattern",
        "measuredExampleCount",
        "recommendationStatus",
        "measuredOutcomeProvenance"
      ],
      "properties": {
        "id": { "type": "string", "minLength": 1 },
        "clusterKey": { "type": "string", "minLength": 1 },
        "rank": { "type": ["integer", "null"], "minimum": 1 },
        "label": { "type": "string", "minLength": 1 },
        "visualFormat": { "$ref": "#/$defs/nullableString" },
        "hookType": { "$ref": "#/$defs/nullableString" },
        "captionArchetype": { "$ref": "#/$defs/nullableString" },
        "qualityScore": { "type": "number" },
        "referenceIds": {
          "type": "array",
          "minItems": 1,
          "items": { "type": "string", "minLength": 1 }
        },
        "promptCardIds": { "type": "array", "items": { "type": "string" } },
        "captionPatternIds": { "type": "array", "items": { "type": "string" } },
        "audioPatternIds": { "type": "array", "items": { "type": "string" } },
        "pattern": { "type": "object" },
        "lifecycle": { "$ref": "#/$defs/patternLifecycle" },
        "measuredExampleCount": { "$ref": "#/$defs/nonNegativeInteger" },
        "recommendationStatus": { "$ref": "#/$defs/recommendationStatus" },
        "measuredOutcomeProvenance": {
          "type": "array",
          "items": { "$ref": "#/$defs/outcomeProvenance" }
        }
      }
    },
    "captionPattern": {
      "type": "object",
      "additionalProperties": false,
      "required": [
        "id",
        "referenceId",
        "normalizedText",
        "firstLine",
        "lineCount",
        "characterCount",
        "averageConfidence",
        "placement"
      ],
      "properties": {
        "id": { "type": "string", "minLength": 1 },
        "referenceId": { "type": "string", "minLength": 1 },
        "normalizedText": { "type": "string" },
        "firstLine": { "$ref": "#/$defs/nullableString" },
        "lineCount": { "$ref": "#/$defs/nonNegativeInteger" },
        "characterCount": { "$ref": "#/$defs/nonNegativeInteger" },
        "averageConfidence": { "type": ["number", "null"] },
        "placement": { "type": "object" }
      }
    },
    "referenceLifecycle": {
      "type": "object",
      "additionalProperties": false,
      "required": [
        "referenceId",
        "rightsStatus",
        "referenceStatus",
        "contradictionStatus",
        "expiresAt",
        "latestEventId",
        "latestEvidenceType",
        "latestEventFingerprint",
        "eligible",
        "blockers"
      ],
      "properties": {
        "referenceId": { "type": "string", "minLength": 1 },
        "rightsStatus": {
          "type": "string",
          "enum": ["unverified", "granted", "revoked", "expired"]
        },
        "referenceStatus": {
          "type": "string",
          "enum": ["active", "deleted"]
        },
        "contradictionStatus": {
          "type": "string",
          "enum": ["clear", "open"]
        },
        "expiresAt": {
          "type": ["string", "null"],
          "format": "date-time"
        },
        "latestEventId": { "$ref": "#/$defs/nullableString" },
        "latestEvidenceType": {
          "type": ["string", "null"],
          "enum": ["evidence", "inference", null]
        },
        "latestEventFingerprint": {
          "type": ["string", "null"],
          "pattern": "^[a-f0-9]{64}$"
        },
        "eligible": { "type": "boolean" },
        "blockers": {
          "type": "array",
          "uniqueItems": true,
          "items": { "type": "string", "minLength": 1 }
        }
      }
    },
    "patternLifecycle": {
      "type": "object",
      "additionalProperties": false,
      "required": [
        "patternId",
        "status",
        "supersededByPatternId",
        "latestEventId",
        "latestEvidenceType",
        "latestEventFingerprint",
        "eligible",
        "blockers"
      ],
      "properties": {
        "patternId": { "type": "string", "minLength": 1 },
        "status": {
          "type": "string",
          "enum": ["legacy_active", "active", "superseded", "invalidated"]
        },
        "supersededByPatternId": { "$ref": "#/$defs/nullableString" },
        "latestEventId": { "$ref": "#/$defs/nullableString" },
        "latestEvidenceType": {
          "type": ["string", "null"],
          "enum": ["evidence", "inference", null]
        },
        "latestEventFingerprint": {
          "type": ["string", "null"],
          "pattern": "^[a-f0-9]{64}$"
        },
        "eligible": { "type": "boolean" },
        "blockers": {
          "type": "array",
          "uniqueItems": true,
          "items": { "type": "string", "minLength": 1 }
        }
      }
    },
    "audioPattern": {
      "type": "object",
      "additionalProperties": false,
      "required": [
        "id",
        "platform",
        "audioId",
        "audioTitle",
        "artistName",
        "usageType",
        "visualFormat",
        "hookType",
        "captionArchetype",
        "postCount",
        "recommendation",
        "sourceSignal"
      ],
      "properties": {
        "id": { "type": "string", "minLength": 1 },
        "platform": { "type": "string", "minLength": 1 },
        "audioId": { "type": "string", "minLength": 1 },
        "audioTitle": { "$ref": "#/$defs/nullableString" },
        "artistName": { "$ref": "#/$defs/nullableString" },
        "usageType": { "type": "string", "minLength": 1 },
        "visualFormat": { "$ref": "#/$defs/nullableString" },
        "hookType": { "$ref": "#/$defs/nullableString" },
        "captionArchetype": { "$ref": "#/$defs/nullableString" },
        "postCount": { "$ref": "#/$defs/nonNegativeInteger" },
        "recommendation": { "type": "object" },
        "sourceSignal": {
          "type": "object",
          "additionalProperties": false,
          "required": ["totalPlays", "medianPlays"],
          "properties": {
            "totalPlays": { "$ref": "#/$defs/nonNegativeInteger" },
            "medianPlays": { "type": ["integer", "null"], "minimum": 0 }
          }
        }
      }
    }
  }
}
